(grok_plays_pokemon)   python corrected_coord_extraction_script.py 
Loading coordinates from: /puffertank/grok_plays_pokemon/environment/environment_helpers/quest_paths
============================================================
  WARNING: No connecting map found, adding map 38 (discontinuity in path)
Loaded quest 001: 2 coordinates from 2 maps (order: ['0', '38'])
Quest 001: Added 2 coords (total: 2, last: (345, 78))
  WARNING: No connecting map found, adding map 0 (discontinuity in path)
  WARNING: No connecting map found, adding map 37 (discontinuity in path)
Loaded quest 002: 24 coordinates from 3 maps (order: ['38', '0', '37'])
Quest 002: Added 24 coords (total: 26, last: (355, 77))
  WARNING: No connecting map found, adding map 40 (discontinuity in path)
Loaded quest 003: 15 coordinates from 2 maps (order: ['0', '40'])
Quest 003: Added 15 coords (total: 41, last: (348, 110))
  WARNING: No connecting map found, adding map 0 (discontinuity in path)
Loaded quest 004: 11 coordinates from 2 maps (order: ['40', '0'])
Quest 004: Added 11 coords (total: 52, last: (350, 96))
  WARNING: No connecting map found, adding map 12 (discontinuity in path)
Loaded quest 005: 18 coordinates from 2 maps (order: ['0', '12'])
Quest 005: Added 18 coords (total: 70, last: (337, 94))
Loaded quest 006: 15 coordinates from 1 maps (order: ['12'])
Quest 006: Added 15 coords (total: 85, last: (327, 90))
  WARNING: No connecting map found, adding map 1 (discontinuity in path)
Loaded quest 007: 48 coordinates from 2 maps (order: ['12', '1'])
Quest 007: Added 48 coords (total: 133, last: (301, 95))
  WARNING: No connecting map found, adding map 42 (discontinuity in path)
Loaded quest 008: 30 coordinates from 2 maps (order: ['1', '42'])
Quest 008: Added 30 coords (total: 163, last: (301, 133))
  WARNING: No connecting map found, adding map 1 (discontinuity in path)
Loaded quest 009: 9 coordinates from 2 maps (order: ['42', '1'])
Quest 009: Added 9 coords (total: 172, last: (286, 103))
  WARNING: No connecting map found, adding map 12 (discontinuity in path)
Loaded quest 010: 29 coordinates from 2 maps (order: ['1', '12'])
Quest 010: Added 29 coords (total: 201, last: (302, 95))
  WARNING: No connecting map found, adding map 40 (discontinuity in path)
  WARNING: No connecting map found, adding map 0 (discontinuity in path)
Loaded quest 011: 59 coordinates from 3 maps (order: ['12', '40', '0'])
Quest 011: Added 59 coords (total: 260, last: (350, 96))
Loaded quest 012: 9 coordinates from 1 maps (order: ['40'])
Quest 012: Added 9 coords (total: 269, last: (348, 110))
  WARNING: No connecting map found, adding map 0 (discontinuity in path)
Loaded quest 013: 11 coordinates from 2 maps (order: ['40', '0'])
Quest 013: Added 11 coords (total: 280, last: (350, 96))
  WARNING: No connecting map found, adding map 39 (discontinuity in path)
Loaded quest 014: 16 coordinates from 2 maps (order: ['0', '39'])
Quest 014: Added 16 coords (total: 296, last: (343, 107))
  WARNING: No connecting map found, adding map 0 (discontinuity in path)
Loaded quest 015: 9 coordinates from 2 maps (order: ['39', '0'])
Quest 015: Added 9 coords (total: 305, last: (344, 97))
  WARNING: No connecting map found, adding map 12 (discontinuity in path)
Loaded quest 016: 11 coordinates from 2 maps (order: ['0', '12'])
Quest 016: Added 11 coords (total: 316, last: (337, 94))
  WARNING: No connecting map found, adding map 41 (discontinuity in path)
  WARNING: No connecting map found, adding map 1 (discontinuity in path)
Loaded quest 017: 73 coordinates from 3 maps (order: ['12', '41', '1'])
Quest 017: Added 73 coords (total: 389, last: (293, 97))
Loaded quest 018: 6 coordinates from 1 maps (order: ['41'])
Quest 018: Added 6 coords (total: 395, last: (297, 118))
  WARNING: No connecting map found, adding map 1 (discontinuity in path)
Loaded quest 019: 7 coordinates from 2 maps (order: ['41', '1'])
Quest 019: Added 7 coords (total: 402, last: (292, 97))
  WARNING: No connecting map found, adding map 42 (discontinuity in path)
Loaded quest 020: 15 coordinates from 2 maps (order: ['1', '42'])
Quest 020: Added 15 coords (total: 417, last: (301, 133))
Loaded quest 021: 4 coordinates from 1 maps (order: ['42'])
Quest 021: Added 4 coords (total: 421, last: (299, 132))
  WARNING: No connecting map found, adding map 1 (discontinuity in path)
Loaded quest 022: 7 coordinates from 2 maps (order: ['42', '1'])
Quest 022: Added 7 coords (total: 428, last: (286, 103))
  WARNING: No connecting map found, adding map 33 (discontinuity in path)
Loaded quest 023: 49 coordinates from 2 maps (order: ['1', '33'])
Quest 023: Added 49 coords (total: 477, last: (283, 66))
Loaded quest 024: 8 coordinates from 1 maps (order: ['33'])
Quest 024: Added 8 coords (total: 485, last: (279, 63))
Loaded quest 025: 1 coordinates from 1 maps (order: ['33'])
Quest 025: Added 1 coords (total: 486, last: (279, 63))
  WARNING: No connecting map found, adding map 50 (discontinuity in path)
  WARNING: No connecting map found, adding map 13 (discontinuity in path)
  WARNING: No connecting map found, adding map 41 (discontinuity in path)
  WARNING: No connecting map found, adding map 1_again (discontinuity in path)
  WARNING: No connecting map found, adding map 1 (discontinuity in path)
Loaded quest 026: 155 coordinates from 6 maps (order: ['33', '50', '13', '41', '1_again', '1'])
Quest 026: Added 155 coords (total: 641, last: (292, 97))
  WARNING: No connecting map found, adding map 51 (discontinuity in path)
Loaded quest 027: 10 coordinates from 2 maps (order: ['50', '51'])
Quest 027: Added 10 coords (total: 651, last: (255, 125))
Loaded quest 028: 20 coordinates from 1 maps (order: ['51'])
Quest 028: Added 20 coords (total: 671, last: (249, 134))
Loaded quest 029: 9 coordinates from 1 maps (order: ['51'])
Quest 029: Added 9 coords (total: 680, last: (241, 134))
Loaded quest 030: 16 coordinates from 1 maps (order: ['51'])
Quest 030: Added 16 coords (total: 696, last: (226, 134))
  WARNING: No connecting map found, adding map 51 (discontinuity in path)
Loaded quest 031: 101 coordinates from 2 maps (order: ['47', '51'])
Quest 031: Added 101 coords (total: 797, last: (208, 109))
  WARNING: No connecting map found, adding map 58 (discontinuity in path)
  WARNING: No connecting map found, adding map 2 (discontinuity in path)
  WARNING: No connecting map found, adding map 13 (discontinuity in path)
Loaded quest 032: 45 coordinates from 4 maps (order: ['47', '58', '2', '13'])
Quest 032: Added 45 coords (total: 842, last: (194, 93))
  WARNING: No connecting map found, adding map 2 (discontinuity in path)
Loaded quest 033: 11 coordinates from 2 maps (order: ['58', '2'])
Quest 033: Added 11 coords (total: 853, last: (184, 87))
  WARNING: No connecting map found, adding map 56 (discontinuity in path)
Loaded quest 034: 24 coordinates from 2 maps (order: ['2', '56'])
Quest 034: Added 24 coords (total: 877, last: (186, 58))
  WARNING: No connecting map found, adding map 2 (discontinuity in path)
Loaded quest 035: 8 coordinates from 2 maps (order: ['56', '2'])
Quest 035: Added 8 coords (total: 885, last: (176, 97))
  WARNING: No connecting map found, adding map 54 (discontinuity in path)
Loaded quest 036: 34 coordinates from 2 maps (order: ['2', '54'])
Quest 036: Added 34 coords (total: 919, last: (178, 67))
  WARNING: No connecting map found, adding map 58 (discontinuity in path)
  WARNING: No connecting map found, adding map 2 (discontinuity in path)
Loaded quest 037: 65 coordinates from 3 maps (order: ['54', '58', '2'])
Quest 037: Added 65 coords (total: 984, last: (184, 87))
  WARNING: No connecting map found, adding map 2 (discontinuity in path)
  WARNING: No connecting map found, adding map 54 (discontinuity in path)
Loaded quest 038: 50 coordinates from 3 maps (order: ['58', '2', '54'])
Quest 038: Added 50 coords (total: 1034, last: (178, 67))
  WARNING: No connecting map found, adding map 2 (discontinuity in path)
Loaded quest 039: 25 coordinates from 2 maps (order: ['54', '2'])
Quest 039: Added 25 coords (total: 1059, last: (176, 90))
  WARNING: No connecting map found, adding map 58 (discontinuity in path)
Loaded quest 040: 62 coordinates from 2 maps (order: ['2', '58'])
Quest 040: Added 62 coords (total: 1121, last: (197, 62))
  WARNING: No connecting map found, adding map 2 (discontinuity in path)
Loaded quest 041: 11 coordinates from 2 maps (order: ['58', '2'])
Quest 041: Added 11 coords (total: 1132, last: (184, 87))
  WARNING: No connecting map found, adding map 14 (discontinuity in path)
Loaded quest 042: 36 coordinates from 2 maps (order: ['2', '14'])
Quest 042: Added 36 coords (total: 1168, last: (176, 114))
Loaded quest 043: 94 coordinates from 1 maps (order: ['14'])
Quest 043: Added 94 coords (total: 1262, last: (174, 173))
  WARNING: No connecting map found, adding map 15 (discontinuity in path)
Loaded quest 044: 11 coordinates from 2 maps (order: ['14', '15'])
Quest 044: Added 11 coords (total: 1273, last: (165, 174))
  WARNING: No connecting map found, adding map 68 (discontinuity in path)
Loaded quest 045: 17 coordinates from 2 maps (order: ['15', '68'])
Quest 045: Added 17 coords (total: 1290, last: (155, 152))
  WARNING: No connecting map found, adding map 15 (discontinuity in path)
Loaded quest 046: 26 coordinates from 2 maps (order: ['68', '15'])
Quest 046: Added 26 coords (total: 1316, last: (154, 175))
============================================================
SUMMARY: Combined 1316 total coordinates from 46 quests

Verifying path continuity between quests:
============================================================
  ✓ Quest 001 -> 002: Connected at (345, 78)
  Gap between quest 002 and 003: (355, 77) -> (343, 89) (distance: 12)
  ✓ Quest 003 -> 004: Connected at (348, 110)
  ✓ Quest 004 -> 005: Connected at (350, 96)
  ✓ Quest 005 -> 006: Connected at (337, 94)
  ✓ Quest 006 -> 007: Connected at (327, 90)
  ✓ Quest 007 -> 008: Connected at (301, 95)
  ✓ Quest 008 -> 009: Connected at (301, 133)
  ✓ Quest 009 -> 010: Connected at (286, 103)
  ✓ Quest 010 -> 011: Connected at (302, 95)
  Gap between quest 011 and 012: (350, 96) -> (356, 110) (distance: 14)
  ✓ Quest 012 -> 013: Connected at (348, 110)
  ✓ Quest 013 -> 014: Connected at (350, 96)
  ✓ Quest 014 -> 015: Connected at (343, 107)
  ✓ Quest 015 -> 016: Connected at (344, 97)
  ✓ Quest 016 -> 017: Connected at (337, 94)
  Gap between quest 017 and 018: (293, 97) -> (319, 138) (distance: 41)
  ✓ Quest 018 -> 019: Connected at (297, 118)
  ✓ Quest 019 -> 020: Connected at (292, 97)
  ✓ Quest 020 -> 021: Connected at (301, 133)
  ✓ Quest 021 -> 022: Connected at (299, 132)
  ✓ Quest 022 -> 023: Connected at (286, 103)
  ✓ Quest 023 -> 024: Connected at (283, 66)
  ✓ Quest 024 -> 025: Connected at (279, 63)
  ✓ Quest 025 -> 026: Connected at (279, 63)
  Gap between quest 026 and 027: (292, 97) -> (263, 124) (distance: 29)
  ✓ Quest 027 -> 028: Connected at (255, 125)
  ✓ Quest 028 -> 029: Connected at (249, 134)
  ✓ Quest 029 -> 030: Connected at (241, 134)
  Gap between quest 030 and 031: (226, 134) -> (200, 106) (distance: 28)
  ✓ Quest 031 -> 032: Connected at (208, 109)
  Gap between quest 032 and 033: (194, 93) -> (197, 62) (distance: 31)
  ✓ Quest 033 -> 034: Connected at (184, 87)
  ✓ Quest 034 -> 035: Connected at (186, 58)
  ✓ Quest 035 -> 036: Connected at (176, 97)
  ✓ Quest 036 -> 037: Connected at (178, 67)
  Gap between quest 037 and 038: (184, 87) -> (193, 62) (distance: 25)
  ✓ Quest 038 -> 039: Connected at (178, 67)
  ✓ Quest 039 -> 040: Connected at (176, 90)
  ✓ Quest 040 -> 041: Connected at (197, 62)
  ✓ Quest 041 -> 042: Connected at (184, 87)
  ✓ Quest 042 -> 043: Connected at (176, 114)
  ✓ Quest 043 -> 044: Connected at (174, 173)
  ✓ Quest 044 -> 045: Connected at (165, 174)
  ✓ Quest 045 -> 046: Connected at (155, 152)

Found 7 discontinuities in the path

Saved combined coordinates to: /puffertank/grok_plays_pokemon/combined_quest_coordinates_continuous.json
Total coordinates: 1316
Quests included: 46

Quest Statistics:
  Quest 001:    2 coordinates (starts at (338, 84), ends at (345, 78))
  Quest 002:   24 coordinates (starts at (345, 78), ends at (355, 77))
  Quest 003:   15 coordinates (starts at (343, 89), ends at (348, 110))
  Quest 004:   11 coordinates (starts at (348, 110), ends at (350, 96))
  Quest 005:   18 coordinates (starts at (350, 96), ends at (337, 94))
  Quest 006:   15 coordinates (starts at (337, 94), ends at (327, 90))
  Quest 007:   48 coordinates (starts at (327, 90), ends at (301, 95))
  Quest 008:   30 coordinates (starts at (301, 95), ends at (301, 133))
  Quest 009:    9 coordinates (starts at (301, 133), ends at (286, 103))
  Quest 010:   29 coordinates (starts at (286, 103), ends at (302, 95))
  Quest 011:   59 coordinates (starts at (302, 95), ends at (350, 96))
  Quest 012:    9 coordinates (starts at (356, 110), ends at (348, 110))
  Quest 013:   11 coordinates (starts at (348, 110), ends at (350, 96))
  Quest 014:   16 coordinates (starts at (350, 96), ends at (343, 107))
  Quest 015:    9 coordinates (starts at (343, 107), ends at (344, 97))
  Quest 016:   11 coordinates (starts at (344, 97), ends at (337, 94))
  Quest 017:   73 coordinates (starts at (337, 94), ends at (293, 97))
  Quest 018:    6 coordinates (starts at (319, 138), ends at (297, 118))
  Quest 019:    7 coordinates (starts at (297, 118), ends at (292, 97))
  Quest 020:   15 coordinates (starts at (292, 97), ends at (301, 133))
  Quest 021:    4 coordinates (starts at (301, 133), ends at (299, 132))
  Quest 022:    7 coordinates (starts at (299, 132), ends at (286, 103))
  Quest 023:   49 coordinates (starts at (286, 103), ends at (283, 66))
  Quest 024:    8 coordinates (starts at (283, 66), ends at (279, 63))
  Quest 025:    1 coordinates (starts at (279, 63), ends at (279, 63))
  Quest 026:  155 coordinates (starts at (279, 63), ends at (292, 97))
  Quest 027:   10 coordinates (starts at (263, 124), ends at (255, 125))
  Quest 028:   20 coordinates (starts at (255, 125), ends at (249, 134))
  Quest 029:    9 coordinates (starts at (249, 134), ends at (241, 134))
  Quest 030:   16 coordinates (starts at (241, 134), ends at (226, 134))
  Quest 031:  101 coordinates (starts at (200, 106), ends at (208, 109))
  Quest 032:   45 coordinates (starts at (207, 109), ends at (194, 93))
  Quest 033:   11 coordinates (starts at (197, 62), ends at (184, 87))
  Quest 034:   24 coordinates (starts at (184, 87), ends at (186, 58))
  Quest 035:    8 coordinates (starts at (186, 58), ends at (176, 97))
  Quest 036:   34 coordinates (starts at (176, 97), ends at (178, 67))
  Quest 037:   65 coordinates (starts at (178, 67), ends at (184, 87))
  Quest 038:   50 coordinates (starts at (193, 62), ends at (178, 67))
  Quest 039:   25 coordinates (starts at (178, 67), ends at (176, 90))
  Quest 040:   62 coordinates (starts at (176, 90), ends at (197, 62))
  Quest 041:   11 coordinates (starts at (197, 62), ends at (184, 87))
  Quest 042:   36 coordinates (starts at (184, 87), ends at (176, 114))
  Quest 043:   94 coordinates (starts at (176, 114), ends at (174, 173))
  Quest 044:   11 coordinates (starts at (174, 173), ends at (165, 174))
  Quest 045:   17 coordinates (starts at (165, 174), ends at (155, 152))
  Quest 046:   26 coordinates (starts at (155, 152), ends at (154, 175))
(grok_plays_pokemon)   